{"schema_version":"local-monitor-repositories.response.v1","workspace_revision":"1111111111111111111111111111111111111111111111111111111111111111","repositories":[{"repository_id":"018f0000-0000-7000-8000-000000000102","display_name":"Synthetic Archived","archive_state":"archived","archive_revision":2,"active_session_count":0,"last_observed_at":null,"assignment_conflict_count":1,"repository_revision":"2222222222222222222222222222222222222222222222222222222222222222"}],"all_session_count":3,"unassigned_active_session_count":1,"archived_repository_count":1,"next_cursor":null}