{"schema_version":"local-monitor-repositories.response.v1","workspace_revision":"3333333333333333333333333333333333333333333333333333333333333333","repositories":[{"repository_id":"018f0000-0000-7000-8000-000000000101","display_name":"Synthetic Active","archive_state":"active","archive_revision":0,"active_session_count":2,"last_observed_at":"2026-01-02T03:04:05.0000000+00:00","assignment_conflict_count":0,"repository_revision":"4444444444444444444444444444444444444444444444444444444444444444"}],"all_session_count":4,"unassigned_active_session_count":1,"archived_repository_count":1,"next_cursor":"AUF5XltXBkN5WI0-UHKGXqqaTTn02EoPxd6KDMHmVA_EMDE4ZjAwMDAtMDAwMC03MDAwLTgwMDAtMDAwMDAwMDAwMTAxFBbBpM3Al3rZwrDA2qFniGeiastYfbtmU9WoptoQ61I"}